{
  "meta": {
    "id": "quake_pak",
    "file-extension": "pak",
    "application": "Quake game engine",
    "endian": "le"
  },
  "seq": [
    {
      "id": "magic",
      "contents": "PACK"
    },
    {
      "id": "index_ofs",
      "type": "u4"
    },
    {
      "id": "index_size",
      "type": "u4"
    }
  ],
  "instances": {
    "index": {
      "pos": "index_ofs",
      "size": "index_size",
      "type": "index"
    }
  },
  "types": {
    "index": {
      "seq": [
        {
          "id": "entries",
          "type": "index_entry",
          "repeat": "eos"
        }
      ]
    },
    "index_entry": {
      "seq": [
        {
          "id": "name",
          "type": "str",
          "size": 56,
          "encoding": "UTF-8"
        },
        {
          "id": "ofs",
          "type": "u4"
        },
        {
          "id": "size",
          "type": "u4"
        }
      ],
      "instances": {
        "body": {
          "pos": "ofs",
          "size": "size",
          "io": "_root._io"
        }
      }
    }
  }
}