{
  "meta": {
    "id": "asn1_der"
  },
  "seq": [
    {
      "id": "type_tag",
      "type": "u1",
      "enum": "type_tag"
    },
    {
      "id": "len",
      "type": "len_encoded"
    },
    {
      "id": "body",
      "size": "len.result",
      "type": {
        "switch-on": "type_tag",
        "cases": {
          "type_tag::sequence_10": "body_sequence",
          "type_tag::sequence_30": "body_sequence",
          "type_tag::set": "body_sequence",
          "type_tag::utf8string": "body_utf8string",
          "type_tag::printable_string": "body_printable_string"
        }
      }
    }
  ],
  "types": {
    "len_encoded": {
      "seq": [
        {
          "id": "b1",
          "type": "u1"
        },
        {
          "id": "int2",
          "type": "u2be",
          "if": "b1 == 0x82"
        }
      ],
      "instances": {
        "result": {
          "value": "(b1 & 0x80 == 0) ? b1 : int2"
        }
      }
    },
    "body_sequence": {
      "seq": [
        {
          "id": "entries",
          "type": "asn1_der",
          "repeat": "eos"
        }
      ]
    },
    "body_utf8string": {
      "seq": [
        {
          "id": "str",
          "type": "str",
          "size-eos": true,
          "encoding": "UTF-8"
        }
      ]
    },
    "body_printable_string": {
      "seq": [
        {
          "id": "str",
          "type": "str",
          "size-eos": true,
          "encoding": "ASCII"
        }
      ]
    }
  },
  "enums": {
    "type_tag": {
      "0": "end_of_content",
      "1": "boolean",
      "2": "integer",
      "3": "bit_string",
      "4": "octet_string",
      "5": "null_value",
      "6": "object_id",
      "7": "object_descriptor",
      "8": "external",
      "9": "real",
      "10": "enumerated",
      "11": "embedded_pdv",
      "12": "utf8string",
      "13": "relative_oid",
      "16": "sequence_10",
      "19": "printable_string",
      "22": "ia5string",
      "48": "sequence_30",
      "49": "set"
    }
  }
}